{
  "schema_version": "v0.1",
  "id": "example_missing_background",
  "task_type": "repair",
  "config_format": "trexfitter-config",
  "split": "train",
  "physics_goal": "Build a one-region counting experiment with signal and the required dominant background.",
  "constraints": ["Only edit configs/example.config.", "Do not change the region definition."],
  "fixture": {
    "id": "example-fixture",
    "config_path": "configs/example.config",
    "sha256": "0000000000000000000000000000000000000000000000000000000000000000"
  },
  "initial_config": "# Fixture content is inserted by the dataset builder.\n",
  "diagnostics": [{"tool": "validate_config", "category": "missing_sample", "message": "Required background sample is absent."}],
  "expected": {
    "reference_patch": "--- a/configs/example.config\n+++ b/configs/example.config\n@@\n-# missing background\n+# add the reviewed background sample here\n",
    "validation": {"must_pass": true, "expected_categories_removed": ["missing_sample"]},
    "metric": {"name": "significance", "minimum": 0.0}
  },
  "metadata": {"purpose": "schema example only; not a trainable physics record"}
}
